{
  "id": "evt-004",
  "title": "Atelier auto-hypnose pour le sommeil",
  "category": "atelier",
  "date_start": "2026-08-10T18:00:00+02:00",
  "date_end": "2026-08-10T20:00:00+02:00",
  "lat": 43.2965,
  "lng": 5.3698,
  "city": "Marseille",
  "description": "Apprenez des techniques d'auto-hypnose pour retrouver un sommeil naturel et réparateur.",
  "link": "https://example.com/atelier-marseille",
  "status": "published"
}
